{
  "v": "ACDC10JSON000abc_",
  "d": "EHostAInterfaceCredSAIDxyz1234567890123_",
  "u": "0AInterfaceNonceABC123",
  "i": "EAdminAIDabcdefghijklmnopqrstuvwxyz1234_",
  "ri": "ERegistryAIDabcdefghijklmnopqrstuvwxy1_",
  "s": "EWireguardInterfaceCredentialSchemaV1_0_0",
  "a": {
    "d": "EAttrBlockSAIDInterface1234567890123456_",
    "u": "0AAttrNonceInterface1",
    "i": "EHostAAIDabcdefghijklmnopqrstuvwxyz123_",
    "dt": "2026-05-18T15:30:00.000Z",
    "interface": {
      "publicKey": "HostAWgPublicKeyBase64Encoded43Chars=",
      "address": ["10.0.0.1/24"],
      "listenPort": 51820,
      "mtu": 1420,
      "dns": ["8.8.8.8", "8.8.4.4"]
    },
    "interfaceMetadata": {
      "interfaceName": "wg-prod-host-a",
      "description": "Production Wireguard interface for Host A",
      "environment": "production"
    }
  }
}
